{
  "eventId": "55555555-5555-4555-8555-555555555555",
  "eventType": "WinnerSelected",
  "occurredAtUtc": "2026-01-15T10:05:00Z",
  "aggregateType": "Auction",
  "aggregateId": "11111111-1111-4111-8111-111111111111",
  "aggregateVersion": 19,
  "correlationId": "correlation-auction-19",
  "tenantId": "aaaaaaaa-1111-4111-8111-111111111111",
  "payload": {
    "tenantId": "aaaaaaaa-1111-4111-8111-111111111111",
    "auctionId": "11111111-1111-4111-8111-111111111111",
    "winningBidId": "22222222-2222-4222-8222-222222222222",
    "winnerId": "bidder-001",
    "amount": 1250.5,
    "selectedAtUtc": "2026-01-15T10:05:00Z",
    "auctionVersion": 19
  }
}
