{
  "eventId": "44444444-4444-4444-8444-444444444444",
  "eventType": "AuctionClosed",
  "occurredAtUtc": "2026-01-15T10:05:00Z",
  "aggregateType": "Auction",
  "aggregateId": "11111111-1111-4111-8111-111111111111",
  "aggregateVersion": 19,
  "correlationId": "correlation-auction-19",
  "tenantId": "aaaaaaaa-1111-4111-8111-111111111111",
  "payload": {
    "tenantId": "aaaaaaaa-1111-4111-8111-111111111111",
    "auctionId": "11111111-1111-4111-8111-111111111111",
    "closedAtUtc": "2026-01-15T10:05:00Z",
    "finalBidAmount": 1250.5,
    "finalBidderId": "bidder-001",
    "auctionVersion": 19
  }
}
