{
  "eventId": "33333333-3333-4333-8333-333333333333",
  "eventType": "BidAccepted",
  "occurredAtUtc": "2026-01-15T10:00:00Z",
  "aggregateType": "Auction",
  "aggregateId": "11111111-1111-4111-8111-111111111111",
  "aggregateVersion": 18,
  "correlationId": "correlation-auction-18",
  "tenantId": "aaaaaaaa-1111-4111-8111-111111111111",
  "payload": {
    "tenantId": "aaaaaaaa-1111-4111-8111-111111111111",
    "bidId": "22222222-2222-4222-8222-222222222222",
    "auctionId": "11111111-1111-4111-8111-111111111111",
    "bidderId": "bidder-001",
    "amount": 1250.5,
    "occurredAtUtc": "2026-01-15T10:00:00Z",
    "auctionVersion": 18
  }
}
